user_A_text,user_B_text,user_A_stance,user_B_stance,user_A_intent,user_B_intent,user_A_valence,user_B_valence,user_A_emotions,user_B_emotions,reconciled_response,approved,reason,toxicity,severe_toxicity,obscene,threat,insult,identity_attack
I absolutely support the new team policy. It's the best we've ever had!,This new policy is terrible and I completely oppose it.,support,neutral,approval,disapproval,0.014914541,-0.026708281,"{'admiration': 0.6072413921356201, 'approval': 0.7753751277923584}",{'disapproval': 0.6885806918144226}," Dear Users A and B,

Thank you both for sharing your perspectives on the new team policy. It's great to see such active participation in discussing our work environment.

User A, it's fantastic to hear your enthusiasm about the new policy! Your positive feedback is valuable as it provides insight into what aspects of the policy are working well for you.

On the other hand, User B, it's important to hear your concerns too. Everyone has different views and experiences, and your constructive criticism can help us understand areas where improvements might be needed.

Let's continue this conversation in a respectful and open manner, focusing on understanding each other's points of view. This will help us create an even better work environment for everyone. Perhaps we can discuss specific instances or aspects of the policy that you both find particularly noteworthy or problematic?

Remember, our goal is to foster a collaborative and inclusive workspace where every voice matters. Let's work together to make our team policy the best it can be for all of us!

Best regards,
[Your Name]",TRUE,,0.000519914,0.000138957,0.000194461,0.000146246,0.000174993,0.000146219
He is a good person.,He is a bad person.,support,oppose,admiration,disgust,0.001730844,-0.137909103,{'admiration': 0.9389538168907166},"{'annoyance': 0.3150940239429474, 'disgust': 0.35506632924079895}"," Hello! It's important to remember that everyone has unique perspectives and experiences, which can influence their opinions. While it seems we have differing views about this person, let's strive for understanding rather than disagreement.

Both of you might be basing your opinions on different aspects or instances in the person's behavior or character. It would be enlightening if we could share more about those experiences to help us appreciate each other's viewpoints better. After all, fostering open dialogue and mutual respect is key to creating a positive and harmonious environment here.

Let's continue this conversation with the intention of learning from one another and promoting understanding between us. Thank you for your cooperation!",TRUE,,0.000520751,0.000147458,0.000201492,0.000162833,0.000180656,0.00015276
New year is a holiday.,New year is not a holiday.,neutral,neutral,neutral,neutral,0.097878627,2.4546869099140167e-05,{'neutral': 0.342722088098526},{'neutral': 0.6516969799995422}," Hello there! It seems we have two different perspectives on what constitutes a holiday for New Year's Day. While some consider it a national or cultural holiday, others might not due to specific circumstances or definitions. Let's appreciate our diverse viewpoints and foster an environment of mutual understanding. Wishing both of you a fantastic start to the new year regardless!",TRUE,,0.000563576,0.000130884,0.000180254,0.000141836,0.00017744,0.000145656
Cricket is the best sport.,Soccer is better than cricket.,support,neutral,admiration,approval,0.0035155353834852576,-0.00023768481332808733,{'admiration': 0.9368424415588379},"{'admiration': 0.3042968511581421, 'approval': 0.6046074628829956}"," Hello there! It's wonderful to see such enthusiasm for sports from both of you. While it's clear that each of you has your favorite, let's take this opportunity to appreciate the unique aspects of both cricket and soccer.

Cricket, with its strategic depth and intricate rules, certainly captivates many around the world. On the other hand, soccer, known for its fast-paced action and global appeal, also holds a special place in the hearts of countless fans.

Instead of focusing on which is 'better,' let's celebrate the joy and camaraderie these sports bring to us. After all, it's the love for the game that truly matters, isn't it? So, here's to both cricket and soccer, and to all the moments they create that bind us together! 😊⚾️🏃‍♂️🥅",True,,0.0005735570448450744,0.00013128154387231916,0.00018920474394690245,0.0001363075862172991,0.00017088319873437285,0.00014486956933978945
Cricket is the best sport.,Soccer is better than cricket.,support,neutral,admiration,approval,0.0035155353834852576,-0.00023768481332808733,{'admiration': 0.9368424415588379},"{'admiration': 0.3042968511581421, 'approval': 0.6046074628829956}"," In the spirit of fostering engaging discussions, it's great to see you both expressing your passion for sports! While some might argue that cricket is the best sport due to its unique blend of strategy and skill, others like soccer appreciate its fast-paced gameplay and global popularity. It's important to remember that everyone has different preferences when it comes to sports, and these discussions can help us learn more about each other's perspectives. Let's keep the conversation going by sharing what we love about both games!",True,,0.0005574481911025941,0.0001327075733570382,0.0001789375237422064,0.00014703936176374555,0.0001739997969707474,0.00014782451034989208
Cricket is the best sport.,Soccer is better than cricket.,support,neutral,admiration,approval,0.0035155353834852576,-0.00023768481332808733,{'admiration': 0.9368424415588379},"{'admiration': 0.3042968511581421, 'approval': 0.6046074628829956}"," Understanding the passion behind sports often stems from personal experiences, cultural influences, and individual preferences. Let's delve into User A's and User B's perspectives to find a common ground that balances their differing opinions.

User A, with a deep-rooted love for cricket, might appreciate the intricacies of the game, such as the strategic planning, the art of bowling, and the tension created during a close match. The social aspect also plays a significant role in User A's emotional bond to cricket, as it offers an opportunity to connect with friends and family during matches.

On the other hand, User B might favor soccer due to its fast-paced action, dynamic teamwork, and global popularity. Soccer's accessibility—both in terms of equipment and physical requirements—might resonate more with User B, making it a more inclusive sport for them.

Both users have valid reasons for their preferences; however, their differences create a barrier to finding common ground. To overcome this obstacle, both parties should be willing to make concessions that respect each other's interests while introducing new experiences.

Here is a proposed plan:

1. Acknowledge and appreciate the unique aspects of each sport that spark passion in User A and User B.
2. Encourage User A to broaden their horizons by watching a soccer match, focusing on its teamwork, fast-paced action, and global appeal. Simultaneously, encourage User B to explore cricket, emphasizing the strategic elements, art of bowling, and the social aspects that make it special.
3. Arrange a friendly competition where both users can participate in each other's preferred sports, either by playing or simply cheering for the teams. This shared experience will foster empathy and understanding between them.
4. Encourage open discussions about the rules, strategies, and history of both sports during these competitions to deepen their knowledge and appreciation for each other's interests.
5. Establish a regular date to watch matches of both sports together, with an agreement that they will alternate which sport is featured on each occasion. This way, neither user feels left out or excluded from their preferred sport.
6. Encourage User A and User B to learn from each other's experiences and share insights gained during the competitions and matches. This will help both parties understand and appreciate the value of each sport beyond their initial perspectives.
7. Reinforce the idea that it is possible to enjoy multiple sports, rather than feeling the need to be loyal to just one. By embracing this mindset, User A and User B can enrich their own experiences while also fostering a more inclusive sports community.",True,,0.0006254074978642166,0.00012332671030890197,0.00018386240117251873,0.00012811858323402703,0.0001744079199852422,0.00014434944023378193
Cricket is the best sport.,Soccer is better than cricket.,support,neutral,admiration,approval,0.0035155353834852576,-0.00023768481332808733,{'admiration': 0.9368424415588379},"{'admiration': 0.3042968511581421, 'approval': 0.6046074628829956}"," User A values the strategic depth and excitement of cricket, finding joy in its intricate rules and the unpredictable outcomes they produce. Their admiration stems from a deep understanding and appreciation for the game's complexity.

User B appreciates soccer for its global reach, fast-paced action, and teamwork. They enjoy watching and playing a sport that requires both skill and physicality, and one that connects people across cultures.

To bridge their differences, User A can accept that soccer offers a broader audience appeal due to its simpler rules and quicker matches, while User B should acknowledge cricket's strategic depth and the unique thrill it provides. Both could agree to appreciate each other's favorite sports for their distinct qualities, making an effort to learn more about them and share their passion with others. In this compromise, both users give up their exclusive allegiance to their respective sports, gaining a broader perspective on sports as a whole.",True,,0.000540694803930819,0.000137276467285119,0.00018796778749674559,0.00014146017201710492,0.00017786346143111587,0.0001503719831816852
Cricket is the best sport.,Soccer is better than cricket.,support,neutral,admiration,approval,0.0035155353834852576,-0.00023768481332808733,{'admiration': 0.9368424415588379},"{'admiration': 0.3042968511581421, 'approval': 0.6046074628829956}"," User A, cricket's appeal lies in its strategic depth, unpredictability, and rich cultural heritage. The emotions it evokes are excitement, camaraderie, and pride. For you, the slower pace allows for intricate planning and tense anticipation.

User B, soccer's allure is its fast-paced action, global popularity, and teamwork. The emotions felt are thrill, unity, and competition. For you, the rapid tempo and physicality make every moment exhilarating.

Compromise: Both sports can agree to appreciate each other's unique aspects. Cricket may adopt shorter formats like T20 for quicker matches, while soccer could incorporate a brief halftime strategy session like cricket does to allow for tactical discussions. This way, both can cater to their respective fanbases while still maintaining the essence of their games.",True,,0.0006342572742141783,0.00012283705291338265,0.00017828303680289537,0.00013011305418331176,0.00017521533300168812,0.00014502684643957764
"Rounaq finds it boring to sit and talk to people, because he thinks its dumb.","Tanay is always keen to sit and talk to people, because he thinks it is wholesome.",oppose,support,neutral,neutral,-0.013392320601269603,0.0017231499077752233,"{'annoyance': 0.3182514011859894, 'neutral': 0.6850841641426086}",{'neutral': 0.8479848504066467}," **User A (Rounaq)**
Persona: Rounaq is a person who values efficiency and directness. He finds sitting and talking with people time-consuming if he perceives the conversations as unproductive or lacking depth. His intent is neutral, but his emotion leans towards frustration due to what he considers wasted time.

**User B (Tanay)**
Persona: Tanay is a sociable individual who values human connection and meaningful dialogue. He finds talking with people enriching and believes these interactions can lead to personal growth and wholesome experiences. His intent is neutral, and his emotion leans towards positivity due to the joy he derives from engaging with others.

Acknowledgement: Both Rounaq's and Tanay's perspectives have their merits. Rounaq seeks productivity, while Tanay values human connection. Both are essential components of a balanced life, but finding the right balance is crucial.

Balanced Response: To maximize productivity and personal growth, it's important to allocate time for both focused work and meaningful conversations. Engaging in stimulating discussions can help foster creativity and innovative ideas, while dedicating time to solo work ensures tasks are completed efficiently. Finding a middle ground where these two aspects coexist is key to striking the right balance.",True,,0.0006039220024831593,0.00012454560783226043,0.00018475213437341154,0.00012658690684475005,0.0001737857237458229,0.00014010167797096074
